Identifier,Relevance,FullStatement,URI
01654e8a-bc4c-11e8-aa2e-0242ac120003,114,"Apply formulas and reason about shapes to solve problems about the area of quadrilaterals, triangles, and complex polygons",http://frameworks.act.org/uri/01654e8a-bc4c-11e8-aa2e-0242ac120003
01895294-bc4c-11e8-aaa3-0242ac120003,114,Apply the principle of transitivity for length measure by comparing two lengths A and C by comparing them both to length B,http://frameworks.act.org/uri/01895294-bc4c-11e8-aaa3-0242ac120003
02892be2-bc4c-11e8-a442-0242ac120003,113,Explain the meaning of each part of a multiplication sentence and interpret the product in the context of the situation,http://frameworks.act.org/uri/02892be2-bc4c-11e8-a442-0242ac120003
01521ea0-bc4c-11e8-b461-0242ac120003,113,"Make a model of a scalene triangle and include appropriate labels (e.g., hash marks to indicate side lengths, right angles)",http://frameworks.act.org/uri/01521ea0-bc4c-11e8-b461-0242ac120003
02b13cc2-bc4c-11e8-ba6d-0242ac120003,113,Understand that the quotient of powers (with like bases) yields that base raised to the difference of the exponents,http://frameworks.act.org/uri/02b13cc2-bc4c-11e8-ba6d-0242ac120003
02765b0c-bc4c-11e8-9a35-0242ac120003,113,Understand that the graph of an equation in two variables is the set of all its solutions plotted in the coordinate plane,http://frameworks.act.org/uri/02765b0c-bc4c-11e8-9a35-0242ac120003
01e5e5e0-bc4c-11e8-b525-0242ac120003,113,"Compare and order fractions with different numerators and denominators for denominators 2, 3, 4, 5, 6, 8, 10, 12, and 100",http://frameworks.act.org/uri/01e5e5e0-bc4c-11e8-b525-0242ac120003
021a9b1e-bc4c-11e8-8b77-0242ac120003,113,"Interpret verbal expressions of three-digit numerals as composed of a hundreds quantity, a decades quantity, and ones",http://frameworks.act.org/uri/021a9b1e-bc4c-11e8-8b77-0242ac120003
025f380a-bc4c-11e8-a38d-0242ac120003,113,"Solve, evaluate, and encode atypical equation structures that are suitable with an operational definition of the equal sign",http://frameworks.act.org/uri/025f380a-bc4c-11e8-a38d-0242ac120003
02880d3e-bc4c-11e8-bcfc-0242ac120003,112,Calculate the total number of objects arranged in a rectangular array with up to 5 rows and 5 columns using addition,http://frameworks.act.org/uri/02880d3e-bc4c-11e8-bcfc-0242ac120003
013ccc4e-bc4c-11e8-a7b7-0242ac120003,112,Decide if two given figures are similar using the definition of similarity and referencing the similarity of transformations,http://frameworks.act.org/uri/013ccc4e-bc4c-11e8-a7b7-0242ac120003
012f3f02-bc4c-11e8-8343-0242ac120003,112,Understand that two measures of the same packing volume with identical cubic units will result in the same measurement,http://frameworks.act.org/uri/012f3f02-bc4c-11e8-8343-0242ac120003
01fdb6e8-bc4c-11e8-8bac-0242ac120003,112,Identify the approximate location of irrational numbers on a number line using knowledge of rational square and cube roots,http://frameworks.act.org/uri/01fdb6e8-bc4c-11e8-8bac-0242ac120003
0141511a-bc4c-11e8-92aa-0242ac120003,112,Understand that transformations are functions that take points in the plane as inputs and give other points as outputs,http://frameworks.act.org/uri/0141511a-bc4c-11e8-92aa-0242ac120003
02a542d2-bc4c-11e8-9dfd-0242ac120003,112,"Processing the text of, representing, and solving multistep word problems involving the 4 operations with signed numbers",http://frameworks.act.org/uri/02a542d2-bc4c-11e8-9dfd-0242ac120003
021afa1e-bc4c-11e8-8a96-0242ac120003,112,"Interpret verbal expressions of three-digit numerals as composed of a hundreds quantity, a decades quantity and ones",http://frameworks.act.org/uri/021afa1e-bc4c-11e8-8a96-0242ac120003
0263a2c8-bc4c-11e8-b687-0242ac120003,112,Calculate elapsed time with 30 minutes at the beginning or end of an interval and convert between hours and whole days,http://frameworks.act.org/uri/0263a2c8-bc4c-11e8-b687-0242ac120003
0200815c-bc4c-11e8-812e-0242ac120003,112,Understand that positive and negative integers are used together to describe quantities having opposite directions or values,http://frameworks.act.org/uri/0200815c-bc4c-11e8-812e-0242ac120003
01696272-bc4c-11e8-9ae4-0242ac120003,111,"Illustrate and identify 2-line angle situations in everyday objects (e.g., road intersections, corner of a room, point in a star)",http://frameworks.act.org/uri/01696272-bc4c-11e8-9ae4-0242ac120003
01966ca4-bc4c-11e8-ba9c-0242ac120003,111,"Understand that a plane refers to a flat, two-dimensional surface with a length and width that expand without limit",http://frameworks.act.org/uri/01966ca4-bc4c-11e8-ba9c-0242ac120003
0228ec32-bc4c-11e8-a455-0242ac120003,111,(MISCONCEPTION) Students believe that fractions' numerators and denominators can be treated as separate whole numbers,http://frameworks.act.org/uri/0228ec32-bc4c-11e8-a455-0242ac120003
01ea4cf2-bc4c-11e8-a7d6-0242ac120003,111,"Investigate and describe the equipartitioning of whole-number intervals on a number line for denominators 2, 3, 4, 6, and 8",http://frameworks.act.org/uri/01ea4cf2-bc4c-11e8-a7d6-0242ac120003
02327234-bc4c-11e8-99b4-0242ac120003,111,Relate written procedures for adding two-digit and one-digit numbers to physical or visual representations of the problem,http://frameworks.act.org/uri/02327234-bc4c-11e8-99b4-0242ac120003
01311412-bc4c-11e8-84aa-0242ac120003,111,Calculate the packing volume of a rectangular prism by tiling only one layer of it and using information about its height,http://frameworks.act.org/uri/01311412-bc4c-11e8-84aa-0242ac120003
018f2368-bc4c-11e8-927d-0242ac120003,111,"Understand that two measures with the same number, but different size, of units results in different object lengths",http://frameworks.act.org/uri/018f2368-bc4c-11e8-927d-0242ac120003
01503d60-bc4c-11e8-9560-0242ac120003,111,"Make a model of a right triangle and include appropriate labels (e.g., hash marks to indicate side lengths, right angles)",http://frameworks.act.org/uri/01503d60-bc4c-11e8-9560-0242ac120003
014e4744-bc4c-11e8-8023-0242ac120003,111,Describe why a quadrilateral does not meet the criteria for a particular category by referencing its sides and angles,http://frameworks.act.org/uri/014e4744-bc4c-11e8-8023-0242ac120003
016b97e0-bc4c-11e8-ba19-0242ac120003,110,"Understand that angle measure is the degree of rotation between two rays, or from a starting position to an end position",http://frameworks.act.org/uri/016b97e0-bc4c-11e8-ba19-0242ac120003
0272dc16-bc4c-11e8-9c81-0242ac120003,110,"Finding and interpreting rules of patterns, graphs, and measures, such as domain, range, and increasing/decreasing intervals",http://frameworks.act.org/uri/0272dc16-bc4c-11e8-9c81-0242ac120003
021d96d4-bc4c-11e8-9ed7-0242ac120003,110,"Understand that in a whole number, the value of a digit in a given place is 10 times its value in the place to its right",http://frameworks.act.org/uri/021d96d4-bc4c-11e8-9ed7-0242ac120003
021a7b20-bc4c-11e8-89cb-0242ac120003,110,"Write and interpret three-digit numerals as a mark composed of a hundreds numeral, decades numeral, and ones numeral",http://frameworks.act.org/uri/021a7b20-bc4c-11e8-89cb-0242ac120003
02898c36-bc4c-11e8-bca8-0242ac120003,110,Rearrange an array to form a new array and describe why the transformation does not change the total number in the array,http://frameworks.act.org/uri/02898c36-bc4c-11e8-bca8-0242ac120003
015c1694-bc4c-11e8-8a30-0242ac120003,110,Apply the principle of transitivity for area measure by comparing two areas A and C by comparing them both to area B,http://frameworks.act.org/uri/015c1694-bc4c-11e8-8a30-0242ac120003
01305f0e-bc4c-11e8-ace0-0242ac120003,110,Investigate and use formulas to solve problems about the packing volume of rectangular prisms with whole number side lengths,http://frameworks.act.org/uri/01305f0e-bc4c-11e8-ace0-0242ac120003
02fa1dca-bc4c-11e8-a519-0242ac120003,110,Understand that the probability of a compound event is also the fraction of outcomes where the compound event occurs,http://frameworks.act.org/uri/02fa1dca-bc4c-11e8-a519-0242ac120003
02150532-bc4c-11e8-98ac-0242ac120003,110,Interpret 2-digit numbers as simultaneously made up of a collection of 10s and 1s and a sequence of decades and ones,http://frameworks.act.org/uri/02150532-bc4c-11e8-98ac-0242ac120003
023b7dfc-bc4c-11e8-997c-0242ac120003,110,"Solve comparison problems within 20 where the smaller amount is unknown and the problem uses the word ""more""",http://frameworks.act.org/uri/023b7dfc-bc4c-11e8-997c-0242ac120003
01562a5e-bc4c-11e8-9d9b-0242ac120003,110,Prove the segment joining midpoints of two sides of a triangle is parallel to the third side and half the length,http://frameworks.act.org/uri/01562a5e-bc4c-11e8-9d9b-0242ac120003
014e8664-bc4c-11e8-9c9f-0242ac120003,110,"Classify quadrilaterals into a hierarchy of categories and sub-categories (e.g. rectangle, square, rhombus, trapezoid)",http://frameworks.act.org/uri/014e8664-bc4c-11e8-9c9f-0242ac120003
01e28012-bc4c-11e8-a096-0242ac120003,110,"Understand that in a decimal number, the value of one place value position is 1/10 the value of the position to its left",http://frameworks.act.org/uri/01e28012-bc4c-11e8-a096-0242ac120003
0297ffbe-bc4c-11e8-a939-0242ac120003,110,"Demonstrate that the commutative property does not hold true for division using objects, drawings, and equations",http://frameworks.act.org/uri/0297ffbe-bc4c-11e8-a939-0242ac120003
0288eccc-bc4c-11e8-a063-0242ac120003,110,Explain the meaning of each part of a division sentence and interpret the quotient in the context of the situation,http://frameworks.act.org/uri/0288eccc-bc4c-11e8-a063-0242ac120003
02e5a232-bc4c-11e8-92df-0242ac120003,110,"Compare counts of categories of tally charts, picture graphs, and data tables and determine greater or less than",http://frameworks.act.org/uri/02e5a232-bc4c-11e8-92df-0242ac120003
02972bac-bc4c-11e8-aa86-0242ac120003,110,Solve simple multiplication and division problems by applying properties of multiplication and recalling basic facts,http://frameworks.act.org/uri/02972bac-bc4c-11e8-aa86-0242ac120003
01e8f514-bc4c-11e8-9955-0242ac120003,110,(MISCONCEPTION) Students have difficulty understanding that two equivalent fractions are the same point on a number line,http://frameworks.act.org/uri/01e8f514-bc4c-11e8-9955-0242ac120003
029c4614-bc4c-11e8-a08f-0242ac120003,109,Multiply a 1-digit factor by a 2-digit factor with products less than 100 and divide using known multiplication facts,http://frameworks.act.org/uri/029c4614-bc4c-11e8-a08f-0242ac120003
0248d830-bc4c-11e8-8fc0-0242ac120003,109,(STRATEGY) Compensate for expected inaccuracy after choosing a computational estimation strategy and computing the answer,http://frameworks.act.org/uri/0248d830-bc4c-11e8-8fc0-0242ac120003
01ad48b6-bc4c-11e8-a9a7-0242ac120003,109,Understand that proofs of the Pythagorean Theorem and its converse allow use of the theorems in all right triangles,http://frameworks.act.org/uri/01ad48b6-bc4c-11e8-a9a7-0242ac120003
02b11cb0-bc4c-11e8-8483-0242ac120003,109,Understand that the product of powers (with like bases) yields that base raised to the sum of the exponents,http://frameworks.act.org/uri/02b11cb0-bc4c-11e8-8483-0242ac120003
02a71918-bc4c-11e8-8115-0242ac120003,109,"Processing the text of, representing, and solving multistep word problems involving the 4 operations with whole numbers",http://frameworks.act.org/uri/02a71918-bc4c-11e8-8115-0242ac120003
016e4940-bc4c-11e8-8bf5-0242ac120003,109,"Classify angles as acute, obtuse, right, straight, or reflex based on angle measure in degrees and/or visual inspection",http://frameworks.act.org/uri/016e4940-bc4c-11e8-8bf5-0242ac120003
02b1dc18-bc4c-11e8-893f-0242ac120003,109,Understand that scientific notation as a way of writing large (or small) numbers to a specified degree of precision,http://frameworks.act.org/uri/02b1dc18-bc4c-11e8-893f-0242ac120003
02b15cac-bc4c-11e8-ac15-0242ac120003,109,Understand that that raising base to a power to a power yields that base raised to the product of the exponents,http://frameworks.act.org/uri/02b15cac-bc4c-11e8-ac15-0242ac120003
0190c330-bc4c-11e8-8142-0242ac120003,109,Calculate the length of a part given a measure for the whole and the measure for other part(s) of the whole,http://frameworks.act.org/uri/0190c330-bc4c-11e8-8142-0242ac120003
02a3f256-bc4c-11e8-8372-0242ac120003,109,"Processing the text of, representing, and solving multistep word problems involving the 4 operations with fractions",http://frameworks.act.org/uri/02a3f256-bc4c-11e8-8372-0242ac120003
013716dc-bc4c-11e8-8949-0242ac120003,109,Calculate the surface area of a pyramid represented by a net by reasoning about the areas of its base and faces,http://frameworks.act.org/uri/013716dc-bc4c-11e8-8949-0242ac120003
01ac4204-bc4c-11e8-963f-0242ac120003,109,"Using hand tools and/or software, construct perpendicular lines, including the perpendicular bisector of a line segment",http://frameworks.act.org/uri/01ac4204-bc4c-11e8-963f-0242ac120003
012274c0-bc4c-11e8-819b-0242ac120003,108,Understand that moving a quantity of fluid units from one container to another does not change the quantity of fluid units,http://frameworks.act.org/uri/012274c0-bc4c-11e8-819b-0242ac120003
0283b45a-bc4c-11e8-b2b2-0242ac120003,108,Relate the equations of vertical and horizontal lines with their graphs using knowledge of slopes and intercepts,http://frameworks.act.org/uri/0283b45a-bc4c-11e8-b2b2-0242ac120003
012e9f52-bc4c-11e8-ad65-0242ac120003,108,Measure the packing volume of a solid figure by counting units laid side-by-side and in layers within its boundaries,http://frameworks.act.org/uri/012e9f52-bc4c-11e8-ad65-0242ac120003
018b6796-bc4c-11e8-a0a8-0242ac120003,108,Measure length by iterating a single unit end to end and demonstrate understanding of the principles of length units,http://frameworks.act.org/uri/018b6796-bc4c-11e8-a0a8-0242ac120003
02f99e22-bc4c-11e8-b7f8-0242ac120003,108,Understand that theoretical probability is probability based on a ratio of favorable outcomes to possible outcomes,http://frameworks.act.org/uri/02f99e22-bc4c-11e8-b7f8-0242ac120003
02cd12bc-bc4c-11e8-a045-0242ac120003,108,Understand that a rational expression refers to an expression which can be written as a ratio of two expressions,http://frameworks.act.org/uri/02cd12bc-bc4c-11e8-a045-0242ac120003
01a19322-bc4c-11e8-80fd-0242ac120003,108,Understand that a vertex refers to the point of intersection where two rays or line segments meet to form an angle,http://frameworks.act.org/uri/01a19322-bc4c-11e8-80fd-0242ac120003
0294b48a-bc4c-11e8-a879-0242ac120003,108,(MISCONCEPTION) Students fail to understand the invert-and-multiply procedure for solving fraction division problems,http://frameworks.act.org/uri/0294b48a-bc4c-11e8-a879-0242ac120003
01a2b5f4-bc4c-11e8-ac57-0242ac120003,108,"Apply definitions of special angle types in order to classify angles as right, acute, obtuse, straight, and reflex",http://frameworks.act.org/uri/01a2b5f4-bc4c-11e8-ac57-0242ac120003
02937660-bc4c-11e8-9ccf-0242ac120003,108,(MISCONCEPTION) Students fail to understand the invert-and-multiply procedure for solving fraction division problems,http://frameworks.act.org/uri/02937660-bc4c-11e8-9ccf-0242ac120003
01db5bde-bc4c-11e8-a75d-0242ac120003,107,"Read, write, and recompose decimals written in standard notation, number names, expanded form, and exponential form",http://frameworks.act.org/uri/01db5bde-bc4c-11e8-a75d-0242ac120003
01409266-bc4c-11e8-ac3e-0242ac120003,107,"Identify aspects of angle measures that change and stay the same when rotating, reflecting, or sliding a geometric figure",http://frameworks.act.org/uri/01409266-bc4c-11e8-ac3e-0242ac120003
01bf60dc-bc4c-11e8-839b-0242ac120003,107,"The order of the number words, application of counting principles, and skills to compare the quantities in sets",http://frameworks.act.org/uri/01bf60dc-bc4c-11e8-839b-0242ac120003
012740ae-bc4c-11e8-9623-0242ac120003,107,"Understand that fewer larger units are needed to measure the mass of an object, and more smaller units are needed",http://frameworks.act.org/uri/012740ae-bc4c-11e8-9623-0242ac120003
01b4e4ae-bc4c-11e8-a8f7-0242ac120003,107,Calculate the measurement of the missing side of a triangle by applying the Law of Sines and the Law of Cosines,http://frameworks.act.org/uri/01b4e4ae-bc4c-11e8-a8f7-0242ac120003
01bbc788-bc4c-11e8-a373-0242ac120003,107,Understand that a measure in a larger unit should be smaller numerically than the same measured in a smaller unit,http://frameworks.act.org/uri/01bbc788-bc4c-11e8-a373-0242ac120003
01f862f6-bc4c-11e8-a686-0242ac120003,107,Understanding that the real number system is not closed and how complex numbers are used to represent nonreal numbers,http://frameworks.act.org/uri/01f862f6-bc4c-11e8-a686-0242ac120003
02d1078c-bc4c-11e8-9070-0242ac120003,107,"Use periodicity of trigonometric functions to model a scenario with specified amplitude, frequency, and midline",http://frameworks.act.org/uri/02d1078c-bc4c-11e8-9070-0242ac120003
01b2898e-bc4c-11e8-903f-0242ac120003,107,Solve real-world and mathematical problems using the relationship between the sine and cosine of complementary angles,http://frameworks.act.org/uri/01b2898e-bc4c-11e8-903f-0242ac120003
01e964cc-bc4c-11e8-a466-0242ac120003,107,Generate equivalent fractions by multiplying the numerator and denominator of a given fraction by the same number,http://frameworks.act.org/uri/01e964cc-bc4c-11e8-a466-0242ac120003
02414eee-bc4c-11e8-b54a-0242ac120003,107,"Represent comparison problems with physical and visual models, and verbal and written expressions/equations",http://frameworks.act.org/uri/02414eee-bc4c-11e8-b54a-0242ac120003
021db7a4-bc4c-11e8-a1bf-0242ac120003,107,"Understand that in a whole number, the value of a digit in a given place is 1/10 its value in the place to its left",http://frameworks.act.org/uri/021db7a4-bc4c-11e8-a1bf-0242ac120003
02447a56-bc4c-11e8-b46c-0242ac120003,107,Understand that the inverse relationship between addition and subtraction is such that a - b = c if and only if b + c = a,http://frameworks.act.org/uri/02447a56-bc4c-11e8-b46c-0242ac120003
01383a30-bc4c-11e8-8fa7-0242ac120003,107,Calculate the surface area of a cylinder represented by a net by reasoning about the area of its base and faces,http://frameworks.act.org/uri/01383a30-bc4c-11e8-8fa7-0242ac120003
01276214-bc4c-11e8-ba90-0242ac120003,107,Understand that two measures of the same object with identical units will result in the same mass measurement,http://frameworks.act.org/uri/01276214-bc4c-11e8-ba90-0242ac120003
01fc0e6a-bc4c-11e8-8684-0242ac120003,107,Understand that scientific notation is a way of writing large or small numbers to a specified degree of precision,http://frameworks.act.org/uri/01fc0e6a-bc4c-11e8-8684-0242ac120003
0200a178-bc4c-11e8-b62b-0242ac120003,107,"Relate negative integers to everyday experiences and explore what negative, positive, and zero mean in their examples",http://frameworks.act.org/uri/0200a178-bc4c-11e8-b62b-0242ac120003
02d0399c-bc4c-11e8-a222-0242ac120003,106,"Find key features of a trigonometric function such as domain, range, amplitude, period, frequency, and midline",http://frameworks.act.org/uri/02d0399c-bc4c-11e8-a222-0242ac120003
017f952e-bc4c-11e8-8faf-0242ac120003,106,"Using the coordinate plane to visualize shapes, determine missing values and properties, and study transformations",http://frameworks.act.org/uri/017f952e-bc4c-11e8-8faf-0242ac120003
021ada84-bc4c-11e8-a2b0-0242ac120003,106,"Write and interpret three-digit numerals as a mark composed of a hundreds quantity, a decades quantity, and ones",http://frameworks.act.org/uri/021ada84-bc4c-11e8-a2b0-0242ac120003
0283341c-bc4c-11e8-8dcc-0242ac120003,106,Understand that x- and y-intercepts are the points where the graph of a linear equations crosses the y- and x-axes,http://frameworks.act.org/uri/0283341c-bc4c-11e8-8dcc-0242ac120003
02a2eed8-bc4c-11e8-bae8-0242ac120003,106,"Processing the text of, representing, and solving multistep word problems involving the 4 operations with decimals",http://frameworks.act.org/uri/02a2eed8-bc4c-11e8-bae8-0242ac120003
01215b12-bc4c-11e8-b397-0242ac120003,106,Understand that a third solid figure can be used to indirectly compare the filling volume of two other solid figures,http://frameworks.act.org/uri/01215b12-bc4c-11e8-b397-0242ac120003
025dce5c-bc4c-11e8-9629-0242ac120003,106,Represent exponential relationships between quantities in two or more variables using equations and inequalities,http://frameworks.act.org/uri/025dce5c-bc4c-11e8-9629-0242ac120003
02dbf50c-bc4c-11e8-a003-0242ac120003,106,"Determine patterns of association in data, and variations of them, in a two-way table using relative frequencies",http://frameworks.act.org/uri/02dbf50c-bc4c-11e8-a003-0242ac120003
0187d2a2-bc4c-11e8-b578-0242ac120003,106,"Understand that in order to provide evidence for length comparison, the endpoints of two objects must be aligned",http://frameworks.act.org/uri/0187d2a2-bc4c-11e8-b578-0242ac120003
0159431a-bc4c-11e8-9e06-0242ac120003,106,"Understand that in order to provide evidence for area comparison, the plane figures must be aligned along one side",http://frameworks.act.org/uri/0159431a-bc4c-11e8-9e06-0242ac120003
012a439e-bc4c-11e8-9fc7-0242ac120003,106,"Solve one-step problems about mass using the four operations with whole units, parts of units, and mixed units",http://frameworks.act.org/uri/012a439e-bc4c-11e8-9fc7-0242ac120003
01eb08d6-bc4c-11e8-9d5a-0242ac120003,106,Identify the number of equal parts into which the interval on a number line between 0 and 1 is equipartitioned,http://frameworks.act.org/uri/01eb08d6-bc4c-11e8-9d5a-0242ac120003
02e34ad2-bc4c-11e8-96d9-0242ac120003,106,"Determine the effect of outliers on the range, interquartile range, and mean absolute deviation of a set of data",http://frameworks.act.org/uri/02e34ad2-bc4c-11e8-96d9-0242ac120003
01b76512-bc4c-11e8-a21c-0242ac120003,105,(MISCONCEPTION) Students pay attention to only one hand on an analogue clock or one part of a digital display,http://frameworks.act.org/uri/01b76512-bc4c-11e8-a21c-0242ac120003
0166526c-bc4c-11e8-b177-0242ac120003,105,Demonstrate that the formulas A = l*w and A = b*h are equivalent by constructing a rectangle from a parallelogram,http://frameworks.act.org/uri/0166526c-bc4c-11e8-b177-0242ac120003
0123587c-bc4c-11e8-8940-0242ac120003,105,Understand that fewer larger fluid units are needed to measure filling volume and more smaller fluid units are needed,http://frameworks.act.org/uri/0123587c-bc4c-11e8-8940-0242ac120003
01b8a490-bc4c-11e8-a2b8-0242ac120003,105,(MISCONCEPTION) Students pay attention to only one hand on an analogue clock or one part of a digital display,http://frameworks.act.org/uri/01b8a490-bc4c-11e8-a2b8-0242ac120003
012f1fc2-bc4c-11e8-b2e4-0242ac120003,105,Illustrate that fewer larger cubic units are needed to measure packing volume and more smaller cubic units are needed,http://frameworks.act.org/uri/012f1fc2-bc4c-11e8-b2e4-0242ac120003
014de79a-bc4c-11e8-a3e7-0242ac120003,105,Understand that hash marks are symbolic notation used to indicate that sides of a shape are of equal length,http://frameworks.act.org/uri/014de79a-bc4c-11e8-a3e7-0242ac120003
014ea662-bc4c-11e8-b35c-0242ac120003,105,Classify a quadrilateral according to the presence of parallel and/or perpendicular sides and type(s) of angle(s),http://frameworks.act.org/uri/014ea662-bc4c-11e8-b35c-0242ac120003
01848c14-bc4c-11e8-b9f0-0242ac120003,105,Understand that a diagonal distance is the distance between two points that do not share an x- or y- coordinate,http://frameworks.act.org/uri/01848c14-bc4c-11e8-b9f0-0242ac120003
015f269a-bc4c-11e8-ba5e-0242ac120003,105,Understand that two measures with the same number of units but different sized units results in different areas,http://frameworks.act.org/uri/015f269a-bc4c-11e8-ba5e-0242ac120003
019da01e-bc4c-11e8-b61b-0242ac120003,104,Understand that perpendicular lines (and line segments) are lines that intersect and form right angles to each other,http://frameworks.act.org/uri/019da01e-bc4c-11e8-b61b-0242ac120003
02ed130a-bc4c-11e8-90e4-0242ac120003,104,Understand that margin of error refers to the half the width of the confidence interval for that statistic,http://frameworks.act.org/uri/02ed130a-bc4c-11e8-90e4-0242ac120003
02da3780-bc4c-11e8-8161-0242ac120003,104,"Processes to calculate and interpret chance, distributions, descriptive statistics, and inferential statistics",http://frameworks.act.org/uri/02da3780-bc4c-11e8-8161-0242ac120003
02cf935c-bc4c-11e8-b960-0242ac120003,104,Understand that the radian measure of an angle is the determined by the length of its arc on the unit circle,http://frameworks.act.org/uri/02cf935c-bc4c-11e8-b960-0242ac120003
012e7f7c-bc4c-11e8-b62b-0242ac120003,104,"Measure a solid object's packing volume by laying 3-D units side-by-side and in layers, with no gaps or overlaps",http://frameworks.act.org/uri/012e7f7c-bc4c-11e8-b62b-0242ac120003
01fd979e-bc4c-11e8-be17-0242ac120003,104,"Compare repeating decimals, terminating decimals, and those which are neither to rational and irrational numbers",http://frameworks.act.org/uri/01fd979e-bc4c-11e8-be17-0242ac120003
021dd892-bc4c-11e8-ac05-0242ac120003,103,Understand the effects of multiplying or dividing a number by 10 and use exponents to denote powers of 10,http://frameworks.act.org/uri/021dd892-bc4c-11e8-ac05-0242ac120003
02fb00dc-bc4c-11e8-b955-0242ac120003,103,Understand that the probability of a compound event is a fraction of the occurring events out of the sample space,http://frameworks.act.org/uri/02fb00dc-bc4c-11e8-b955-0242ac120003
0199e578-bc4c-11e8-b124-0242ac120003,103,"Identify, draw, label, and use symbolic notation for special pairs of lines, line segments, and rays on a plane",http://frameworks.act.org/uri/0199e578-bc4c-11e8-b124-0242ac120003
